{
  "schema_version": "felra-run-manifest-v0.1",
  "subject_id": "mko-euclid-pythagorean-theorem",
  "project_id": "ocme-pythagorean-finite-check",
  "producer_version": "1.0.0",
  "runtime": "python/felra",
  "command": "felra run felra/pythagorean/project.yaml --output artifacts/felra/pythagorean",
  "evidence_type": "finite_computational_check",
  "status": "passed",
  "claim_scope": {
    "quantification": "finite_declared_domain",
    "universal_proof": false,
    "statement_zh": "在 FELRA 宣告的有限整數域與固定種子反例搜尋中，任何滿足 a²+b²=c² 的三元組，其 c 不小於 a 與 b。"
  },
  "checks": [
    { "id": "boundaries", "status": "passed" },
    { "id": "counterexample_search", "status": "passed" },
    { "id": "numerical", "status": "passed" }
  ],
  "limitations": [
    "宣告網格只涵蓋整數 a,b,c 介於 1 與 50。",
    "隨機反例搜尋使用固定種子與有限樣本預算。",
    "這項結果只支持宣告域內的計算性質，不構成畢達哥拉斯定理的普遍證明。"
  ],
  "project_path": "felra/pythagorean/project.yaml",
  "result_sources": [
    {
      "role": "felra_result_snapshot",
      "path": "evidence-sources/felra/results/pythagorean-result.json"
    },
    {
      "role": "felra_runtime_lock",
      "path": "felra/FELRA_LOCK.json"
    }
  ],
  "replay": {
    "command": "felra replay artifacts/felra/pythagorean --output artifacts/felra/pythagorean-replay",
    "expected_exit_code": 0,
    "source_artifact": "evidence-sources/felra/results/pythagorean-result.json"
  }
}
